{
  "caseApplicationReferences": [
    "28DI6032316"
  ],
  "cases": [
    {
      "caseId": "8cf054cb-c3b9-4a38-bc09-d7fbb291eabf",
      "caseStatus": "ACTIVE",
      "defendantCaseOffences": [
        {
          "allocationDecision": "Summary-only offence",
          "civilOffence": false,
          "code": "CA03012",
          "convictingCourtCode": "2577",
          "convictionDate": "2025-12-12",
          "convictionStatus": "Convicted",
          "dateFromWhichDisqRemoved": "",
          "disqualificationPeriod": "000600",
          "dttpDtetp": "",
          "dvlaCode": "NE98",
          "endorsableFlag": false,
          "fine": "",
          "interimImposedFinalSentence": "",
          "modeOfTrial": "Summary",
          "otherSentence": "E06M",
          "penaltyPoints": "",
          "plea": "GUILTY",
          "results": [
            {
              "d20": false,
              "dvlaCode": "E",
              "label": "Conditional discharge",
              "prompts": [
                {
                  "durationSequence": 1,
                  "label": "PeriodÂ of conditional discharge",
                  "promptIdentifier": "d3205319-84cf-4c5b-9d7a-7e4bb1865054",
                  "promptReference": "periodofConditionalDischarge",
                  "value": "6 Months"
                }
              ],
              "publishedForNows": false,
              "resultIdentifier": "554c2622-c1cc-459e-a98d-b7f317ab065c"
            },
            {
              "d20": true,
              "label": "Discretionary with ordinary disqualification",
              "prompts": [
                {
                  "label": "Licence issue number",
                  "promptIdentifier": "11a939b1-71e6-4065-8c29-007e4b52da7a",
                  "promptReference": "licenceIssueNumber",
                  "value": "23"
                },
                {
                  "durationSequence": 1,
                  "label": "Disqualification period",
                  "promptIdentifier": "2bf54447-328c-4c1b-a123-341adbd52172",
                  "promptReference": "disqualificationPeriod",
                  "value": "6 Months"
                }
              ],
              "publishedForNows": false,
              "resultIdentifier": "ccfc452e-ebe4-4cd7-b8a0-4f90768447b4",
              "resultWording": "Disqualified for holding or obtaining a driving licence. Discretionary disqualification. Driving record endorsed. Section 34(2) Road Traffic Offenders Act 1988"
            },
            {
              "d20": false,
              "label": "1: Prov DVLA produced",
              "prompts": [
                {
                  "label": "Licence issue number",
                  "promptIdentifier": "11a939b1-71e6-4065-8c29-007e4b52da7a",
                  "promptReference": "licenceIssueNumber",
                  "value": "23"
                }
              ],
              "publishedForNows": true,
              "resultIdentifier": "4b850aa9-984c-4a15-a1ae-b2f861cfcbe8"
            }
          ],
          "startDate": "2022-12-12",
          "title": "Possess / control TV set with intent another use install without a licence",
          "wording": "Roosevelt Wiza have set up a TV cable without a valid license."
        }
      ],
      "hasSV": false,
      "initiationCode": "C",
      "reference": "28DI6032316"
    }
  ],
  "courtApplications": [],
  "defendant": {
    "address": {
      "line1": "21",
      "line2": "Furnburry Park Road",
      "line3": "London",
      "postCode": "SW11 3TQ"
    },
    "dateOfBirth": "1991-02-18",
    "firstName": "Roosevelt",
    "gender": "MALE",
    "lastName": "Wiza",
    "name": "Roosevelt Wiza",
    "title": "MR"
  },
  "distinctPrompts": [
    {
      "label": "Licence issue number",
      "promptIdentifier": "11a939b1-71e6-4065-8c29-007e4b52da7a",
      "promptReference": "licenceIssueNumber",
      "value": "23"
    }
  ],
  "identifier": "1db40ecd-5b89-4561-9507-2172a9be98a2",
  "licenceProducedInCourt": "1: Prov DVLA produced",
  "masterDefendantId": "2a37feb4-0f4f-427d-aab9-bcdc56554089",
  "materialId": "6c2988a7-d7dc-40cb-aa25-13bd39677d72",
  "orderDate": "2025-12-12",
  "orderingCourt": {
    "address": {
      "address1": "176A Lavender Hill",
      "address2": "London",
      "address3": "",
      "address4": "",
      "address5": "",
      "postcode": "SW11 1JU"
    },
    "code": "B01LY00",
    "courtHearingLocation": "B01LY01",
    "id": "f8254db1-1683-483e-afb3-b87fde5a0a26",
    "lja": {
      "ljaCode": "2577",
      "ljaName": "South West London Magistrates' Court"
    },
    "name": "Lavender Hill Magistrates' Court",
    "roomId": "9e4932f7-97b2-3010-b942-ddd2624e4dd8",
    "roomName": "Courtroom 01"
  },
  "orderingCourtCode": "2577",
  "orderingHearingId": "936644c3-2cac-4b78-bf7a-f03f700fb31d",
  "retrySequence": 0
}