{  "caseApplicationReferences": [    "89QB632195"  ],  "cases": [    {      "caseId": "03c77559-d9a8-49c9-8bc3-645a45d6ef99",      "caseStatus": "ACTIVE",      "defendantCaseOffences": [        {          "civilOffence": false,          "code": "TH68023",          "convictionStatus": "Not Convicted",          "dateFromWhichDisqRemoved": "",          "disqualificationPeriod": "",          "dttpDtetp": "",          "dvlaCode": "NE98",          "endorsableFlag": false,          "fine": "",          "interimImposedFinalSentence": "",          "modeOfTrial": "Indictable",          "otherSentence": "E06M",          "penaltyPoints": "",          "results": [            {              "d20": false,              "dvlaCode": "E",              "label": "Conditional discharge",              "prompts": [                {                  "durationSequence": 1,                  "label": "Period of conditional discharge",                  "promptIdentifier": "d3205319-84cf-4c5b-9d7a-7e4bb1865054",                  "promptReference": "periodofConditionalDischarge",                  "value": "6 Months"                }              ],              "publishedForNows": false,              "resultIdentifier": "554c2622-c1cc-459e-a98d-b7f317ab065c"            },            {              "d20": true,              "label": "Driving record endorsed (no points)",              "publishedForNows": false,              "resultIdentifier": "b0aeb4fc-df63-4e2f-af88-97e3f23e847f"            },            {              "d20": false,              "label": "0: None or unknown",              "publishedForNows": true,              "resultIdentifier": "c3a39c2f-b056-442f-8dfc-604b5434f956"            }          ],          "startDate": "2019-11-28",          "title": "Robbery",          "wording": "From 13th November 2018, an aggravated version of this offence applies where the offence is committed against an emergency worker acting in the exercise of his / her functions as such a worker, as per section 1 of the Assaults on emergency Workers (Offences) Act 2018; see offence wording document H19568."        },        {          "civilOffence": false,          "code": "CA03012",          "convictionStatus": "Not Convicted",          "dateFromWhichDisqRemoved": "",          "disqualificationPeriod": "000600",          "dttpDtetp": "",          "dvlaCode": "NE98",          "endorsableFlag": false,          "fine": "",          "interimImposedFinalSentence": "2",          "modeOfTrial": "Summary",          "otherSentence": "E06M",          "penaltyPoints": "",          "results": [            {              "d20": false,              "dvlaCode": "E",              "label": "Conditional discharge",              "prompts": [                {                  "durationSequence": 1,                  "label": "Period of conditional discharge",                  "promptIdentifier": "d3205319-84cf-4c5b-9d7a-7e4bb1865054",                  "promptReference": "periodofConditionalDischarge",                  "value": "6 Months"                }              ],              "publishedForNows": false,              "resultIdentifier": "554c2622-c1cc-459e-a98d-b7f317ab065c"            },            {              "d20": true,              "label": "Discretionary with ordinary disqualification",              "prompts": [                {                  "durationSequence": 1,                  "label": "Disqualification period",                  "promptIdentifier": "2bf54447-328c-4c1b-a123-341adbd52172",                  "promptReference": "disqualificationPeriod",                  "value": "6 Months"                },                {                  "label": "Date of Interim Disqualification",                  "promptIdentifier": "7fd83833-178c-48db-866b-33fc9e69a0d1",                  "promptReference": "600704c8-686a-49d1-b0db-3f67e22553ab",                  "value": "Starting from date (date of interim disqualification):01/06/2026"                }              ],              "publishedForNows": false,              "resultIdentifier": "ccfc452e-ebe4-4cd7-b8a0-4f90768447b4",              "resultWording": "Disqualified for holding or obtaining a driving licence. Discretionary disqualification. Driving record endorsed. Section 34(2) Road Traffic Offenders Act 1988"            },            {              "d20": false,              "label": "Date of Interim Disqualification",              "prompts": [                {                  "label": "Starting from date (date of interim disqualification)",                  "promptIdentifier": "03fe43ad-1857-4ba1-8481-6c660744b617",                  "promptReference": "startingFromDateDateOfInterimDisqualification",                  "value": "01/06/2026"                }              ],              "publishedForNows": true,              "resultIdentifier": "7fd83833-178c-48db-866b-33fc9e69a0d1"            },            {              "d20": false,              "label": "0: None or unknown",              "publishedForNows": true,              "resultIdentifier": "c3a39c2f-b056-442f-8dfc-604b5434f956"            }          ],          "startDate": "2019-11-28",          "title": "Possess / control TV set with intent another use install without a licence",          "wording": "From 13th November 2018, an aggravated version of this offence applies where the offence is committed against an emergency worker acting in the exercise of his / her functions as such a worker, as per section 1 of the Assaults on emergency Workers (Offences) Act 2018; see offence wording document H19568."        }      ],      "hasSV": false,      "initiationCode": "C",      "reference": "89QB632195"    }  ],  "courtApplications": [],  "defendant": {    "address": {      "line1": "799",      "line2": "StreetDescription",      "line3": "Locality2O",      "postCode": "TW14 9XA"    },    "dateOfBirth": "1983-05-14",    "firstName": "Mike1",    "gender": "MALE",    "lastName": "Blick",    "middleName": "Jac ",    "name": "Mike1 Jac  Blick",    "title": "Mr"  },  "distinctPrompts": [],  "identifier": "45eae45e-5fc4-4d08-a735-86404da25bad",  "licenceProducedInCourt": "0: None or unknown",  "masterDefendantId": "7f149498-7ab4-4ea0-b103-1375d31b07f7",  "materialId": "7d457ec3-0538-4873-a13d-0d158bf73d06",  "orderDate": "2025-12-11",  "orderingCourt": {    "address": {      "address1": "176A Lavender Hill",      "address2": "London",      "address3": "",      "address4": "",      "address5": "",      "postcode": "SW11 1JU"    },    "code": "B01LY00",    "courtHearingLocation": "B01LY01",    "id": "f8254db1-1683-483e-afb3-b87fde5a0a26",    "lja": {      "ljaCode": "2577",      "ljaName": "South West London Magistrates' Court"    },    "name": "Lavender Hill Magistrates' Court",    "roomId": "9e4932f7-97b2-3010-b942-ddd2624e4dd8",    "roomName": "Courtroom 01"  },  "orderingCourtCode": "2577",  "orderingHearingId": "43350a82-0405-42c9-8963-39571712afc6",  "retrySequence": 0}